INSERT_DATETIME,URI,TOPIC,TOPIC_URI,TITLE,BODY,URL,RELEVANCE_CLASS,BODY_SUMMARY,EVENTURI,SOURCE,METADATA,ARTICLE_HIERARCHY,VERIFIED
2023-11-10T08:01:19.941Z,7828653005,general_medical_trend,7e974a24-3df6-40a6-b8aa-a1d5bd15a5e5,Ultraviolet radiation,"Simple and effective prevention measures are available. Sun protection is recommended when the ultraviolet index is 3 and above.

Ultraviolet radiation (UVR) can neither be seen nor felt. While some people are exposed to artificial UVR sources (e.g. in medicine, industry and for disinfection and cosmetic purposes), everyone is exposed to solar UVR. Solar UVR levels are influenced by several factors:

Small amounts of UVR are beneficial to health and play an essential role in the production of vitamin D. However, excessive exposure to UVR is associated with negative health consequences as UVR is carcinogenic to humans.

Acute effects of UVR include DNA damage, sunburn, phototoxic and photoallergic reactions, and suppression of the immune system. Immunosuppression can be considered as a risk factor for cancer and can cause reactivation of viruses (e.g. cold sores in the lip).

Chronic effects on skin and lips from UVR exposure include:

Excessive exposure to UVR caused around 1.2 million new cases of non-melanoma skin cancers (SCC and BCC) and 325 000 melanomas of the skin, and 64 000 premature deaths from non-melanoma and 57 000 melanomas of the skin in the year 2020.

Acute effects of UVR include photokeratitis and photoconjunctivitis (inflammation of the cornea and conjunctiva, respectively). These effects are reversible, easily prevented by protective eyewear and are not usually associated with any long-term damage but are painful and might require therapeutic intervention.

Chronic effects of UVR include:

UV exposure may also be involved in the development of age-related macular degeneration (AMD).

Worldwide, it is estimated that 15 million people are blind due to cataracts; of these, some 10% may be due to exposure to UVR.

UVR in small amounts is essential to good health as it leads to the production of vitamin D in the body. Vitamin D strengthens the bone and musculoskeletal system. People who have very low sun exposure - such as those in institutional care or housebound, people with deeply pigmented skin living in high latitudes or those who, for religious or cultural reasons cover their entire body surface when they are outdoors - should consider oral vitamin D supplementation.

Children and adolescents are particularly vulnerable to the harmful effects of UVR due to their skin and eye structure. Sunburns in childhood lead to a higher risk of skin cancer in later life. Also, a larger amount of UVR can reach and damage their retina.

Fair-skinned people suffer more from sunburn and have a higher risk of skin cancer than dark-skinned people; however, darker-skinned people also develop skin cancers. Consideration of eye damage is important for everyone.

People at increased risk include those with a high number of naevi, those taking photosensitizing medication, and those with a family history of skin cancer.

Outdoor workers exposed occupationally to solar UVR levels face an increased risk of developing non-melanoma skin cancers.

Skin cancer is highly preventable. WHO recommends the following measures to protect against excessive exposure to UVR.

Encouraging children to take the simple precautions above will prevent both short-term and long-term damage while still allowing them to enjoy the time they spend outdoors.

WHO aims to reduce the burden of disease resulting from exposure to UVR. It encourages research, develops guidance and disseminates information tools about effective UVR protection interventions related to the public, occupationally exposed workers and patients.

The Global Solar UV index (UVI), an information tool that describes the level of solar UVR at the Earth's surface, was developed by WHO, the United Nations Environment Programme (UNEP), the World Meteorological Organization (WMO) and the International Commission on Non-Ionizing Radiation Protection (ICNIRP).

The UVI is an indicator of the potential for skin damage. It alerts people about the need to adopt protective measures when exposed to UVR. The higher the UVI value, the greater the potential for damage to the skin and eye, and the less time it takes for harm to occur. Sun protection measures should be used when the UVI reaches 3 or above.",https://www.who.int/news-room/fact-sheets/detail/ultraviolet-radiation,-1,,eng-9045075,"{'uri': 'who.int', 'dataType': 'news', 'title': 'who.int', 'ranking': {'importanceRank': 162264, 'alexaGlobalRank': 1298, 'alexaCountryRank': 1813}}",,,TRUE
2023-11-10T08:01:19.941Z,7828324350,general_medical_trend,7e974a24-3df6-40a6-b8aa-a1d5bd15a5e5,Episode #107 - How is climate change affecting your health?,"We are living with climate change every day and it is already impacting our health. What are the future scenarios and what can each of us do to cope with the impact of climate change?

We are talking to today. Welcome, Diarmid. Diarmid, talk to us about the impact of climate change on our health.

So some of the effects are really direct. So sometimes it's just too hot to be healthy. So we know that climate change is increasing temperatures, particularly in cities. And anybody with a pre-existing condition or if you are older or if you have, for example, heart disease, unfortunately, you're more likely to get sick when temperatures are very high or even to die in extreme high temperatures. So that's a very direct effect.

We also see the effects of climate change on the environment. So those increased temperatures and changes in rainfall patterns in some parts of the world are drying out the environment, drying out forests, making it easier to have more and stronger severe wildfires. Now wildfires kill people directly.

They also lead to massive levels of air pollution. And we know that air pollution is one of the biggest killers we have. Kills about 7 million people a year around the world, about a death every five seconds. So there are those more direct effects.

But we also see climate change is making it easier to transmit infectious diseases carried by mosquitoes like malaria or dengue, or diseases carried in water, diarrheal disease, cholera and so on.

But the ultimate impact of climate change is in actually making some parts of the world uninhabitable. So either it becomes too dry to maintain agriculture or through increased sea level rise. we are actually starting to submerge islands, including some whole countries. And you can't really maintain good health when you're forcing people away from where they live.

So Diarmid, talk to us about scenarios that we are staring at. How will our health systems, our hospitals, primary health care centers, the entire health infrastructure -- how will we cope with these impacts of climate change on our health?

Well, the scenarios are not good news because and we already know we've already seen a glimpse of this. So those increased temperatures I was talking about. The record temperatures that we're now seeing around the world in a couple of decade's time, those will be the norm. And so we've experienced record temperatures in Europe. We've seen heatwaves across Asia, and we've seen directly people turning up overwhelming hospitals and in some cases in some of the historic events, even morgues overflowing with bodies. So unfortunately, that's part of the scenarios that we see for the future.

We also see more of the world being suitable for malaria transmission or for dengue transmission. So we have to be able to respond to this. And we're unfortunately committed to a certain amount of climate change because of the greenhouse gases that have already been emitted.

So we need to develop the plans and put into place the investments in our hospitals, in the training of our health workforce, in order to allow them to protect people from the impacts of climate change that we're already seeing. And part of preparing our health systems for the impacts of climate change is also making sure that they're resilient to the impacts of climate change.

And in fact, in many cases, we can do two good things for the price of one by, for example, providing renewable energy through solar panels, for health care facilities, which is more resilient to climate risks. It's cheaper and it also reduces the environmental impact.

So these are very overwhelming scenarios that you've just painted. What can we do as individuals to cope and to protect ourselves in these future scenarios?

Well, the good news is there's a great deal that we can do. And part of it is just being aware of the health risks of climate change. So in the places that we live in northern Europe, those populations have not previously been used to the kinds of temperatures that we've previously experienced. Now, if we know that it's a potential risk to your health, if it's an extremely hot day, then it's possible to protect yourself by hydrating, by staying out of the sun, by paying attention to weather warnings. So we all, as individuals, have to become a bit climate smarter in order to protect our health. So that's number one.

The second thing that we can do is that many of the things that are important to reduce climate change are really good for our health. And we actually say that the Paris Agreement to limit climate change is potentially the most important health agreement of the century, because if we are able to make a shift to a clean energy system or even as individuals, if we're able to, for example, walk or cycle to work or school or to improve our diet so that they're more sustainable and healthy, that's really good for the planet. But much more importantly, and closer to home, it's really good for your health. It's not all on you as an individual.

So one of the things we can do as individuals is to support policies and to support leaders who are able to make wise investment decisions that improve people's health, but also protects the planet.

Thank you Diarmid. That was Science in 5 today. Until next time, then stay safe, stay healthy and stick with science.",https://www.who.int/podcasts/episode/science-in-5/episode--107---how-is-climate-change-affecting-your-health,-1,,,"{'uri': 'who.int', 'dataType': 'news', 'title': 'who.int', 'ranking': {'importanceRank': 162264, 'alexaGlobalRank': 1298, 'alexaCountryRank': 1813}}",,,TRUE
2023-11-08T20:01:08.537Z,2023-11-150421106,general_medical_trend,7e974a24-3df6-40a6-b8aa-a1d5bd15a5e5,Tuberculosis (TB),"Nguyen Viet Tung_Viet Nam

A boy holding TB banner, Clicked by Nguyen Viet Tung-Vietnam. Youth movement against TB in Hua Dan primary school, Chang Muong Commune, Muong La, Son La (A remote commune).

Overview

Tuberculosis (TB) is an infectious disease that most often affects the lungs and is caused by a type of bacteria. It spreads through the air when infected people cough, sneeze or spit.

Tuberculosis is preventable and curable.

About a quarter of the global population is estimated to have been infected with TB bacteria. About 5-10% of people infected with TB will eventually get symptoms and develop TB disease.

Those who are infected but not (yet) ill with the disease cannot transmit it. TB disease is usually treated with antibiotics and can be fatal without treatment.

In certain countries, the Bacille Calmette-Guérin (BCG) vaccine is given to babies or small children to prevent TB. The vaccine prevents TB outside of the lungs but not in the lungs.

Symptoms

People with latent TB infection don't feel sick and aren't contagious. Only a small proportion of people who get infected with TB will get TB disease and symptoms. Babies and children are at higher risk.

Certain conditions can increase a person's risk for tuberculosis disease:

Unlike TB infection, when a person gets TB disease, they will have symptoms. These may be mild for many months, so it is easy to spread TB to others without knowing it.

The symptoms people get depend on where in the body TB becomes active. While TB usually affects the lungs, it also affects the kidneys, brain, spine and skin.

Prevention

Follow these steps to help prevent tuberculosis infection and spread:

Special measures like respirators and ventilation are important to reduce infection in healthcare and other institutions.

Diagnosis

WHO recommends the use of rapid molecular diagnostic tests as the initial diagnostic test in all persons with signs and symptoms of TB.

Rapid diagnostic tests recommended by WHO include the Xpert MTB/RIF Ultra and Truenat assays. These tests have high diagnostic accuracy and will lead to major improvements in the early detection of TB and drug-resistant TB.

A tuberculin skin test (TST) or interferongamma release assay (IGRA) can be used to identity people with infection.

Diagnosing multidrug-resistant and other resistant forms of TB (see multidrug-resistant TB section below) as well as HIV-associated TB can be complex and expensive.

Tuberculosis is particularly difficult to diagnose in children.

Treatment

Tuberculosis disease is treated with antibiotics. Treatment is recommended for both TB infection and disease.

To be effective, these medications need to be taken daily for 4-6 months. It is dangerous to stop the medications early or without medical advice. This can allow TB that is still alive to become resistant to the drugs.

Tuberculosis that doesn't respond to standard drugs is called drug-resistant TB and requires more toxic treatment with different medicines.

Multidrug-resistant TB

Drug resistance emerges when TB medicines are used inappropriately, through incorrect prescription by health care providers, poor quality drugs, or patients stopping treatment prematurely.

Multidrug-resistant tuberculosis (MDR-TB) is a form of TB caused by bacteria that do not respond to isoniazid and rifampicin, the 2 most effective first-line TB drugs. MDR-TB is treatable and curable by using second-line drugs. However, second-line treatment options require extensive medicines that are expensive and toxic.

In some cases, more extensive drug resistance can develop. TB caused by bacteria that do not respond to the most effective second-line TB drugs can leave patients with very limited treatment options.

MDR-TB remains a public health crisis and a health security threat. Only about 2 in 5 people with drug resistant TB accessed treatment in 2022.

In accordance with WHO guidelines, detection of MDR/RR-TB requires bacteriological confirmation of TB and testing for drug resistance using rapid molecular tests or culture methods.

In 2022, new WHO guidelines prioritize a 6-month regimen - the BPaLM/BPaL - as a treatment of choice for eligible patients. The shorter duration, lower pill burden and high efficacy of this novel regimen can help ease the burden on health systems and save precious resources to further expand the diagnostic and treatment coverage for all individuals in need. In the past, MDR-TB treatment used to last for at least 9 months and up to 20 months. WHO recommends expanded access to all-oral regimens.

TB and HIV

People living with HIV are 16 (uncertainty interval 14-18) times more likely to fall ill with TB disease than people without HIV. TB is the leading cause of death among people with HIV.

HIV and TB form a lethal combination, each speeding the other's progress. Without proper treatment, 60% of HIV-negative people with TB on average and nearly all HIV-positive people with TB will die. In 2022, about 167 000 people died of HIV-associated TB. The percentage of notified TB patients who had a documented HIV test result in 2022 was 80%, up from 76% in 2021. The WHO African Region has the highest burden of HIV-associated TB. Overall in 2022, only 54% of TB patients known to be living with HIV were on antiretroviral therapy (ART).

WHO recommends a 12-component approach of collaborative TB-HIV activities, including actions for prevention and treatment of infection and disease, to reduce deaths.

Impact

Tuberculosis mostly affects adults in their most productive years. However, all age groups are at risk. Over 80% of cases and deaths are in low- and middle-income countries.

TB occurs in every part of the world. In 2022, the largest number of new TB cases occurred in WHO's South-East Asian Region (46%), followed by the African Region (23%) and the Western Pacific (18%). Around 87% of new TB cases occurred in the 30 high TB burden countries, with more than two-thirds of the global total in Bangladesh, China, Democratic Republic of the Congo, India, Indonesia, Nigeria, Pakistan and the Philippines. Globally, about 50% of TB patients and their households face total costs (direct medical expenditures, non-medical expenditures and indirect costs such as income losses) that are catastrophic (>20% of total household income), far from the WHO End TB Strategy target of zero. Those with compromised immune systems, such as people living with HIV, undernutrition or diabetes, or people who use tobacco, have a higher risk of falling ill. Globally in 2022, there were 2.2 million new TB cases that were attributable to undernutrition, 0.89 million to HIV infection, 0.73 million to alcohol use disorders, 0.70 million to smoking and 0.37 million to diabetes.

Investments to end TB

US$ 13 billion are needed annually for TB prevention, diagnosis, treatment and care to achieve global targets agreed on at the UN high level-TB meeting.

As in the past decade, most of the spending on TB services in 2022 (80%) was from domestic sources. In low- and middle-income countries, international donor funding remains crucial. The main source is the Global Fund to Fight AIDS, Tuberculosis and Malaria (the Global Fund). The United States Government is the largest contributor of funding to the Global Fund and also the largest bilateral donor. For research and development, according to the Treatment Action Group, only US$ 1 billion were available in 2022 of the US$ 2 billion required per year to accelerate the development of new tools. At least an extra US$ 1 billion per year is needed to accelerate the development of new tools.

WHO response

WHO is working closely with countries, partners and civil society in scaling up the TB response. Six core functions are being pursued by WHO to contribute to achieving the targets of the UN high-level meeting political declaration, Sustainable Development Goals, End TB Strategy and WHO strategic priorities:",https://www.who.int/news-room/fact-sheets/detail/tuberculosis,-1,,eng-9038865,"{'uri': 'who.int', 'dataType': 'news', 'title': 'who.int', 'ranking': {'importanceRank': 162264, 'alexaGlobalRank': 1298, 'alexaCountryRank': 1813}}",,,TRUE
2023-11-08T14:01:18.374Z,2023-11-150162822,general_medical_trend,7e974a24-3df6-40a6-b8aa-a1d5bd15a5e5,"WHO, UNICEF, and Gavi, the Vaccine Alliance pass the mid-point of the global 10-year strategy to eliminate yellow fever epidemics","The Eliminate Yellow fever Epidemics (EYE) Strategy - a partnership led by the World Health Organization (WHO), UNICEF, and Gavi, the Vaccine Alliance - launches a report following its mid-term evaluation in 2022

Following devastating outbreaks in Angola and the Democratic Republic of the Congo in 2016 that saw exportation of cases to China, the EYE Strategy - a global coalition of over 50 partners in 40 countries - was launched to accelerate efforts to prevent outbreaks, protect at-risk populations, and save lives across the continent.

The global strategy addresses several challenges including yellow fever's changing epidemiology; the worldwide resurgence of the primary vector responsible for urban yellow fever outbreaks (aedes aegypti mosquito), and the increasing risk of international spread.

An independent mid-term evaluation of the EYE Strategy (covering 2017 to 2021), was undertaken by the Euro Health Group - with guidance from WHO, UNICEF, and Gavi evaluation offices - as an opportunity to take stock of the Strategy's progress to date and to determine how best to move closer to protecting almost 1 billion people in Africa and in the Americas from yellow fever by 2026.

Since 2017, according to EYE Strategy data, 226 million more people in Africa have been protected from yellow fever via a single-dose vaccine that provides lifelong protection. Under the previous yellow fever initiative, 108 million people were protected in an 8-year period. The EYE Strategy's global coalition has contributed to the acceleration of vaccination during this period.

""The EYE Strategy has worked closely with Member States and communities through integrated programmes to rapidly respond to outbreaks of yellow fever. This has been done through enhancing vaccine coverage, surveillance, and diagnostics to curb the deadly impact of this disease in Africa and the Americas,"" says Dr Mike Ryan, Executive Director of WHO's Health Emergencies Programme. ""We have seen a resurgence of outbreaks of this disease in previously immunized areas, with risk in urban centres, which tells us the threat is far from over. Evidence shows that we are on the path to eliminating yellow fever epidemics, but our work is not yet done.""

On the Strategy's historic immunization milestone Dr Kate O'Brien, Director of WHO's Department of Immunization, Vaccines and Biologicals states, ""The evaluation evidence shows that through collaboration and co-ordinated action, the EYE Strategy has yielded significant results. Yellow fever vaccination campaigns have protected 226 million people in Africa since it was launched in 2017[BAR1] , and most high-risk countries have introduced the yellow fever vaccine into their routine immunization schedules. This has helped to prevent major disease outbreaks in sub-Saharan Africa. However, the numbers of unvaccinated children remain high, and we must continue to work successfully in partnership to ensure those gaps are filled quickly through improvements to essential immunization programmes and vaccination campaigns when needed.""

The evaluation report shows that despite the significant achievements of the Strategy, there are challenges. Key gaps include low prioritization of yellow fever due to competing public health priorities in countries, and the need for increased engagement by governments to implement prevention and control measures, which can include targeted catch-up vaccination campaigns to fill immunization gaps. There also needs to be a continued focus on outbreak preparedness, readiness, and response.

""In July 2023, WHO and UNICEF published updated data for 2022 on the number of children who have missed out on critical vaccinations as part of their country's routine immunization schedules,"" says Dr Ephrem Lemango, Associate Director and Chief of Immunization at UNICEF. ""Although we are making good progress after the disruption of the pandemic, there is still work to be done to ensure that governments continue to prioritize yellow fever. It is possible to eliminate these epidemics in our lifetime.""

With climate change and the rise in environmental issues, such as deforestation, yellow fever continues to threaten the health and livelihoods of vulnerable populations, especially in densely populated cities. These factors pose the greatest threat of catastrophic outbreaks and international exportation of the disease, risking multi-country epidemics and putting global health security at risk.

""The recent rise in outbreaks and the risks they entail are why the introduction of the yellow fever vaccine into routine immunization programmes is so important."" said Dr Kelechi Ohiri, Managing Director of Policy, Programme Design & Delivery Support at Gavi, the Vaccine Alliance. ""We will continue to work with countries and partners supporting routine introductions, filling immunization gaps, and improving readiness for outbreak response so that we achieve our common goals.""

Yellow fever is endemic in multiple countries in both Africa and the Americas. A deep dive into best practices and lessons learned in Brazil and Ghana are also included in the report (links in country names). Both countries have a history of yellow fever outbreaks and have implemented preventive mass vaccination campaigns.

The EYE partners are committed to intensifying efforts across both continents to support nations implementing the Strategy and to ensure a world free from yellow fever epidemics by 2026.

Learn more about WHO's work on yellow fever https://www.who.int/health-topics/yellow-fever#tab=tab_1

Fact sheet on yellow fever: https://www.who.int/news-room/fact-sheets/detail/yellow-fever",https://www.who.int/news/item/08-11-2023-who--unicef--and-gavi--the-vaccine-alliance-pass-the-mid-point-of-the-global-10-year-strategy-to-eliminate-yellow-fever-epidemics,-1,,eng-9045088,"{'uri': 'who.int', 'dataType': 'news', 'title': 'who.int', 'ranking': {'importanceRank': 162264, 'alexaGlobalRank': 1298, 'alexaCountryRank': 1813}}",,,TRUE
