INSERT_DATETIME,URI,TOPIC,TOPIC_URI,TITLE,BODY,URL,RELEVANCE_CLASS,BODY_SUMMARY,EVENTURI,SOURCE,METADATA,ARTICLE_HIERARCHY,VERIFIED
2023-10-20T03:01:44.765Z,2023-10-125458591,general_medical_trend,7e974a24-3df6-40a6-b8aa-a1d5bd15a5e5,Osteoarthritis,"With ageing populations and increasing rates of obesity and injury, the prevalence of osteoarthritis is expected to continue to increase globally.

Osteoarthritis is a degenerative joint condition. It causes pain, swelling and stiffness, affecting a person's ability to move freely.

Osteoarthritis affects the entire joint, including the tissues around it. It is most common in the knees, hips, spine and hands.

Many factors can contribute to developing osteoarthritis. Some include a history of joint injury or overuse, older age and being overweight. It affects women more than men.

Exercise and healthy eating to build strong muscles and keep a healthy weight can reduce symptoms. Surgery to replace joints is used in severe cases to reduce pain and regain mobility.

Once pain and loss of movement function become chronic, people with osteoarthritis often experience restrictions in participating in meaningful activities, decreased well-being, and psychological distress.

Scope of the problem

Osteoarthritis is one of the significant contributors to years lived with disability among the musculoskeletal conditions. As osteoarthritis is more prevalent in older people (about 70% are older than 55), global prevalence is expected to increase with the ageing of populations. The typical onset is in the late 40s to mid-50s, although osteoarthritis may also affect younger people, including athletes and people who sustain joint injury or trauma. About 60% of people living with osteoarthritis are women.

Signs and symptoms

Symptoms of osteoarthritis include pain, swelling, stiffness and trouble moving the affected joint.

As a consequence of reduced movement, muscles often lose strength and people become less able to perform physical activities.

Osteoarthritis can affect any joint but is most common in the knees, hips, spine and small joints in the hands. Muscles and tissue around the joint are often affected.

Symptoms can develop slowly or start quickly after an injury or strain. Osteoarthritis is chronic and often progressive, so changes happen gradually over time.

In severe cases, it can make the joint unusable and cause long-term pain. Some people feel pain even when resting.

Being less physically active can lead to other conditions, including cardiovascular diseases, obesity and diabetes.

Osteoarthritis can greatly reduce the quality of life. It makes movement painful and difficult, which can stop people from participating in home, work or social activities. This can lead to mental health impacts, trouble sleeping and problems in relationships.

Cause and risk factors

Several risk factors are known to increase the risk of developing osteoarthritis:

Prevention and control

Several key prevention strategies have been proposed to prevent osteoarthritis and control the disease progression. In particular, reducing overuse of joints (e.g. related to workload), and promoting healthy lifestyles (e.g. regular physical activity, maintaining a normal body weight) play an important role.

Treatment and management

Management of osteoarthritis often involves different health workers, who contribute to a rehabilitative strategy tailored to a person's needs and preferences.

Being diagnosed early and following a treatment plan is the best way to slow the disease and optimize function.

Exercise can strengthen the affected muscles and help mobility. Other therapeutic approaches can help the joint to move properly and allow people to continue their daily activities.

Braces and other assistive technologies can help people to stay independent when movement becomes more difficult.

Medicines like non-steroidal anti-inflammatory drugs (NSAIDs) may be prescribed to control pain.

Joint replacement surgery can reduce pain, restore movement and improve quality of life for most people with severely affected joints. These surgeries are most commonly performed at the hip and knee.

It is important to stay at a healthy weight. Education and counselling are important to help people manage their symptoms and work-related tasks.

Most guidelines suggest that opioid analgesics, glucosamine and visco-supplementation therapies are not effective for osteoarthritis and there is insufficient evidence to suggest stem cell therapy is beneficial.

Self-care

Self-care is an important part of managing osteoarthritis. Education and support can help people learn to cope with the physical and mental effects of osteoarthritis. People with osteoarthritis should speak to a health worker to build a tailored care plan.

Staying active and maintaining a healthy weight can help reduce symptoms and the risk of their progression.

WHO response

WHO is taking action to extend access to care for people with osteoarthritis in different ways:

WHO Rehabilitation 2030 Initiative:

The Package of Interventions for Rehabilitation provides information on essential interventions for rehabilitation (including assistive products), and human and material resources for 20 health conditions, including osteoarthritis.

UN Decade of Healthy Ageing:

WHO recommends a reorientation of health and care systems to promote healthy ageing and address the diverse needs of older persons.

The Integrated Care for Older People (ICOPE) approach promotes the person-centred assessment of the older person to guide the design of personalized, health and social care, including long-term care interventions. Specific recommendations are provided to prevent the loss of locomotor and psychological capacity because of pain.

1. GBD 2019: Global burden of 369 diseases and injuries in 204 countries and territories, 1990-2019: a systematic analysis for the Global Burden of Disease Study 2019. https://vizhub.healthdata.org/gbd-results/.

2. Long H, Liu Q, Yin H, Diao N, Zhang Y, Lin J et al. Prevalence trends of site-specific osteoarthritis from 1990 to 2019: Findings from the global burden of disease study 2019. Arthritis Rheumatol 2022; 74(7): 1172-1183.3. Cieza A, Causey K, Kamenow K, Wulf Hansen S, Chatterji S, Vos T. Global estimates of the need for rehabilitation based on the Global Burden of Disease study 2019: a systematic analysis for the Global Burden of Disease Study 2019. Lancet. 2020 Dec 19; 396(10267): 2006-2017.",https://www.who.int/news-room/fact-sheets/detail/osteoarthritis,-1,,,"{'uri': 'who.int', 'dataType': 'news', 'title': 'who.int', 'ranking': {'importanceRank': 162264, 'alexaGlobalRank': 1298, 'alexaCountryRank': 1813}}",,,TRUE
2023-10-20T03:01:44.765Z,7790223923,general_medical_trend,7e974a24-3df6-40a6-b8aa-a1d5bd15a5e5,"WHO releases new list of essential diagnostics; new recommendations for hepatitis E virus tests, personal use glucose meters","The World Health Organization (WHO) has released its 2023 Essential Diagnostics List (EDL), which is an evidence-based register of in vitro diagnostics (IVD) that supports countries to make national diagnostic choices.

This year's list includes two firsts:

Hepatitis E occurs around the world both as outbreaks and as sporadic cases. While most people recover completely, a small proportion (up to 4%) develop acute liver failure, which is higher in pregnant women (mortality rates 19.3-63.6%). Hepatitis E infection is under-reported and the addition of these diagnostics will support governments to manage outbreaks.

Diabetes is a chronic disease causing 1.5 million deaths in 2019 with higher disease incidence and impact in lower-middle-income countries. The disease consequence can be avoided or delayed with diet, physical activity, medication and regular glucose monitoring. Including personal glucose testing devices on the Essential Diagnostics List could lead to better disease management and reduced negative outcomes.

While not prescriptive, the Essential Diagnostics List has the potential to help countries with their plans to improve access to in vitro diagnostics by providing a policy framework to enable informed decision-making for national Essential Diagnostics Lists. The ambition is that governments can use the List to improve in vitro diagnostics testing services in their country which will translate into increased access to diagnostics and better patient outcomes.

""The rapid development and global deployment of diagnostics early in the COVID-19 pandemic was vital in tracking the spread of the virus, detecting, isolating and treating those infected and protecting those at risk,"" said Dr Tedros Adhanom Ghebreyesus, WHO Director-General. ""The WHO Essential Diagnostics List is a critical tool that gives countries evidence-based recommendations to guide local decisions to ensure the most important and reliable diagnostics are available to health workers and patients.""

For the 2023 Essential Diagnostics List, the WHO Strategic Advisory Group of Experts on in vitro diagnostics (SAGE IVD) reviewed 12 applications and recommended the addition of eight in IVDs and several edits to previously listed EDL tests, including IVDs for tuberculosis, HIV and diabetes mellitus.

Other new tests added to the list include those for endocrine disorders; reproductive, maternal and new-born health; and cardiovascular health:

With the recent adoption of the WHA 76.5 resolution on strengthening diagnostics capacity, Member States are urged to consider the establishment of national diagnostics strategies as part of their national health plans, and to consider the development of national essential diagnostics lists, adapting the WHO model list of essential in vitro diagnostics. WHO is advising and supporting multiple countries across the world on their efforts to develop EDLs, through webinars, workshops and direct country support.

Updated biennially, the Essential Diagnostics List is intended to support national in vitro diagnostics policy development and to improve access to IVD testing and clinical laboratory services. As well as informing national EDLs, it provides advice on prioritization of IVDs at different levels of the healthcare system. Additionally, it informs United Nations agencies and non-government organizations that support the selection, procurement, supply or donation of In Vitro Diagnostics along with guidance to the private health technology and manufacturing sectors about the IVDs priorities required to address global health issues.",https://www.who.int/news/item/19-10-2023-who-releases-new-list-of-essential-diagnostics--new-recommendations-for-hepatitis-e-virus-tests--personal-use-glucose-meters,-1,,eng-8986921,"{'uri': 'who.int', 'dataType': 'news', 'title': 'who.int', 'ranking': {'importanceRank': 162264, 'alexaGlobalRank': 1298, 'alexaCountryRank': 1813}}",,,TRUE
2023-10-20T03:01:44.765Z,2023-10-124782657,general_medical_trend,7e974a24-3df6-40a6-b8aa-a1d5bd15a5e5,Rabies outbreak response: Accelerating a One Health approach in East Nusa Tenggara,"Rabies is a zoonotic viral disease that is 100% vaccine-preventable, yet it continues to claim thousands of lives, with over 100 deaths in Indonesia in 2022 alone. Rabies is endemic in 26 provinces in Indonesia, with 74 cases of human rabies out of 66,170 bite cases from suspected rabid animals reported in the country from January to July 2023. In line with the Global Strategic Plan to end human deaths from dog-mediated rabies by 2030, WHO along with One Health partners unite under the 'United Against Rabies' initiative and recently helped improve provincial collaboration among stakeholders in the animal and human health sectors in Bali, Indonesia.",https://www.who.int/indonesia/news/detail/18-10-2023-rabies-outbreak-response--accelerating-a-one-health-approach-in-east-nusa-tenggara,-1,,,"{'uri': 'who.int', 'dataType': 'news', 'title': 'who.int', 'ranking': {'importanceRank': 162264, 'alexaGlobalRank': 1298, 'alexaCountryRank': 1813}}",,,TRUE
2023-10-20T03:01:44.765Z,2023-10-124131510,pandemics_large_scale_diseases,7e974a24-3df6-40a6-b8aa-a1d5bd15a5e5,Diphtheria-Guinea,"On 5 September 2023, the Ministry of Health notified WHO of a diphtheria outbreak in Guinea. From 4 July to 13 October 2023, a total of 538 cases of diphtheria, were reported in the Kankan region, in the east-central part of Guinea. Of the total cases reported, 520 are suspected and 18 confirmed with 58 deaths including 13 among confirmed cases (case fatality rate (CFR) among all cases, 11%). The 1-4 years age group accounted for the largest proportion of reported cases. Diphtheria is a highly contagious vaccine-preventable disease caused mainly by the bacteria Corynebacterium diphtheriae which can be fatal in 5-10% of cases, with a higher mortality rate in young children. However, in settings with poor access to diphtheria antitoxin, the CFR can be as high as 40%. Diphtheria remains a significant health problem in countries with poor routine vaccination coverage. According to WHO/UNICEF estimates of national immunization coverage (WUENIC), the immunization coverage with the diphtheria tetanus toxoid and pertussis (DTP3) containing vaccine was reported to be 47% for 2022 in Guinea and has remained below 50% since 2014. This is insufficient for achieving the coverage of 80-85% required to maintain community protection. WHO assesses the risk of diphtheria to be high in Guinea, considering the chronically low vaccination coverage.

On 5 September 2023, the Ministry of Health notified WHO of the current diphtheria outbreak in Guinea. On 4 July 2023, two children aged 2 and 4 years, attended the otolaryngology department of the Siguiri prefectural hospital in the Kankan region of Guinea, for similar symptoms (dyspnea, dysphasia, fever, cough). They were hospitalized for tonsillitis and respiratory infection and received antibiotic treatment before being referred to the Kankan regional hospital for additional care.

Since 4 July and as of 13 October 2023, 538 cases have been reported, including 18 confirmed cases. In total, 58 deaths including 13 among confirmed cases were registered (case fatality rate (CFR) among all cases, 11%)., and 461 contacts are being followed up. Of the cases reported, 62% are female. The 1-4 years age group, with 445 cases, accounted for the largest proportion of reported cases, 82%, followed by the 5-9 years age group, with 5% and 5% for the 10 years and above age group. Children under the age of 12 months make up 7% of reported cases. None of the 538 cases were vaccinated.

Kankan Region is divided into five prefectures and only the Kérouané prefecture has not reported any cases to date.

The prefecture of Siguiri is the most affected, with 510 cases (95%). Of the 363 patients admitted to the treatment centers in Siguiri, 37 (10%) have died.

Other prefectures reporting cases are Mandiana (13 cases), Kankan (13 cases) and Kouroussa (two cases). Of the 15 patients admitted in the treatment center in Kankan, 12 (80%) have died.

The treatment centers in the country do not have the capacity in terms of human resources and material for adequate case management. Suspected and confirmed cases were treated with Amoxicillin and Azithromycin as first line therapy. Antibiotic prophylaxis (Amoxicillin, Azithromycin) was administered to the direct contacts.

Figure 1: Distribution of diphtheria cases in Kankan region, Guinea, as of 13 October 2023",https://www.who.int/emergencies/disease-outbreak-news/item/2023-DON492,1,,eng-8982704,"{'uri': 'who.int', 'dataType': 'news', 'title': 'who.int', 'ranking': {'importanceRank': 162264, 'alexaGlobalRank': 1298, 'alexaCountryRank': 1813}}",,,TRUE
2023-10-20T03:01:44.765Z,7785094573,general_medical_trend,7e974a24-3df6-40a6-b8aa-a1d5bd15a5e5,Rheumatoid arthritis,"While rheumatoid arthritis is a systemic autoimmune disease that affects multiple body systems, the joints of hands, wrists, feet, ankles, knees, shoulders and elbows are most often affected (3).

Rheumatoid arthritis (RA) is a chronic disease that causes inflammation around the body and commonly presents with pain in the joints.

Untreated, RA can cause severe damage to the joints and their surrounding tissue. It can lead to heart, lung or nervous system problems.

Common symptoms include chronic pain, stiffness, tenderness, heat and swelling in the joints. RA can make it hard to move and perform daily activities.

The causes of rheumatoid arthritis are unknown. Risk factors include smoking, obesity and exposure to air pollution. Women and older people have a higher risk of developing RA.

If diagnosed timely, symptoms and disease progression can be controlled with pharmacological treatment, and optimal functioning can be maintained through rehabilitation (including the use of assistive products). In cases with severe joint damage, surgical procedures, including joint replacement, may help to restore movement or manage pain, and maintain physical function.

The typical onset of the disease occurs in adults in their sixties. Women are two-to-three times more often affected than men. The prevalence of rheumatoid arthritis is higher in industrialized countries, which may be explained by demographics (higher average age), exposures to environmental toxins and lifestyle risk factors, and under-diagnosis in low-and-middle-income countries.

Rheumatoid arthritis causes inflammation and pain in one or more joints. It can happen in most joints, but it's most common in the small joints of the hands, wrists and feet.

RA is chronic and may worsen over time without treatment. It can lead to severe damage to the joint and surrounding tissue. It can also affect the heart, lung and nervous systems.

Early signs and symptoms:

The symptoms can worsen over time and spread to more joints including the knees, elbows or shoulders. RA can make it hard to perform daily activities like writing, holding objects with the hands, walking and climbing stairs.

People with RA often feel fatigue and general malaise (e.g., fever, poor sleep quality, loss of appetite) and may experience depressive symptoms.

Pain and difficulty moving can lead to problems with sexual function and intimate relationships. Trouble moving easily can cause lower physical fitness and lead to loss of independence, inability to work, reduced well-being and mental health problems.

The specific causes for the disease are still unknown, but several modifiable lifestyle-associated (smoking, obesity) and non-modifiable (genetics, female gender, age) risk factors have been identified.

Several key prevention strategies have been proposed to prevent rheumatoid arthritis and control the disease progression. In particular, reducing exposure to inhaled silica, dusts and occupational risks, and lifestyle related behaviours (e.g., prevention of/stop smoking, healthy nutrition, physical activity, maintaining a normal body weight, maintaining good dental hygiene) play an important role. Some evidence also suggests breastfeeding may be protective to the mother (4).

Rheumatoid arthritis is not curable. Management of rheumatoid arthritis often involves different health workers, who contribute to a rehabilitative strategy tailored to a person's needs and preferences.

Early diagnosis and management can reduce symptoms, slow the disease and prevent disability. In some cases, the disease can go into remission.

Therapeutic approaches help to improve and maintain joint mobility and muscle strength, to reduce and cope with pain, and to increase exercise capacity and the ability to perform daily activities.

Assistive technologies (e.g., orthosis, assistive products for self-care) help people to protect their joints and to perform meaningful activities independently.

Medicines to reduce inflammation, pain and swelling may include:

In severe cases, orthopaedic surgery can reduce pain and restore movement. Rehabilitation is essential to achieve the best outcomes following surgery.

It is important to keep a healthy lifestyle. Education and counselling are important to help people manage their symptoms and work-related tasks.

Rheumatoid arthritis is a chronic condition that impacts many aspects of life. Lifestyle changes are often needed for individuals and their families.

Education and support help people with rheumatoid arthritis to develop strategies to cope with the disease. It is important to maintain a healthy lifestyle with regular physical activity and a nutritious diet.

WHO is taking action to extend access to care in rheumatoid arthritis in different ways:

WHO Rehabilitation 2030 Initiative:

The Package of Interventions for Rehabilitation provides information on essential interventions for rehabilitation (including assistive products), and human and material resources for 20 health conditions, including rheumatoid arthritis.

UN Decade of Healthy Ageing:

WHO recommends a reorientation of health and care systems to promote healthy ageing and address the diverse needs of older persons.

The Integrated Care for Older People (ICOPE) approach promotes the person-centred assessment of the older person to guide the design of personalized, health and social care, including long-term care interventions. Specific recommendations are provided to prevent the loss of locomotor and psychological capacity because of pain.

(1) GBD 2019: Global burden of 369 diseases and injuries in 204 countries and territories, 1990-2019: a systematic analysis for the Global Burden of Disease Study 2019. https://vizhub.healthdata.org/gbd-results/.

(2) Cieza A, Causey K, Kamenow K, Wulf Hansen S, Chatterji S, Vos T. Global estimates of the need for rehabilitation based on the Global Burden of Disease study 2019: a systematic analysis for the Global Burden of Disease Study 2019. Lancet. 2020 Dec 19; 396(10267): 2006-17.

(3) Long H, Liu Q, Yin H, Diao N, Zhang Y, Lin J et al. Prevalence trends of site-specific osteoarthritis from 1990 to 2019: Findings from the global burden of disease study 2019. Arthritis Rheumatol 2022; 74(7): 1172-83.

(4) Koller-Smith L, Mehdi AM, March L, Tooth L, Mishra GD, Thomas R. Rheumatoid arthritis is a preventable disease: 11 ways to reduce your patients' risk. Internal Medicine Journal 2022;52:711-6.",https://www.who.int/news-room/fact-sheets/detail/rheumatoid-arthritis,-1,,eng-8977668,"{'uri': 'who.int', 'dataType': 'news', 'title': 'who.int', 'ranking': {'importanceRank': 162264, 'alexaGlobalRank': 1298, 'alexaCountryRank': 1813}}",,,TRUE
