INSERT_DATETIME,URI,TOPIC,TOPIC_URI,TITLE,BODY,URL,RELEVANCE_CLASS,BODY_SUMMARY,EVENTURI,SOURCE,METADATA,ARTICLE_HIERARCHY,VERIFIED
2023-11-21T02:01:01.258Z,7847188992,general_biz_trend,57d980ca-52a0-4362-b4d6-57d79043a703,"Agri chief says actions taken to assure supply, affordable prices of rice, sugar, onions","Agriculture Secretary Francisco Tiu Laurel, Jr. on Tuesday said he assured lawmakers that his agency is closely watching the market and is taking steps to assure a sufficient supply of food items at affordable prices, particularly rice, sugar, and onions.

Appearing before the Committee on Agriculture and Food of the House of Representatives on Monday, Laurel said he gave importers less than five weeks to use the permits granted to them to buy an additional one million tons of rice from abroad to boost local stocks.

""Sabi ko kapag hindi ninyo iimport yan within 30 days, kakanselahin ko lahat yan because I don't want to be held hostage by permits that were issued to them upon their request,"" Laurel told lawmakers.

By assuring import permits are used quickly, the Department of Agriculture could better manage the supply of rice, the country's main food staple, and avoid price surges that hurt consumers.

The DA expects total palay harvest this year to exceed 20 million metric tons compared to 19.76 million tons last year while total rice imports are projected at 2.86 million tons -- barring additional imports in the coming weeks -- down one million tons from 2022 levels. The DA said that based on current numbers, the country has a rice surplus of 2.98 million metric tons which is enough to last 80 days.

Additional imports would extend that supply period through the next harvest season starting in March. The high global price of rice due mainly to India's ban on export of non-basmati rice, however, has discouraged rice importation.

Meanwhile, House committee chairman Quezon Rep. Wilfrido Mark Enverga sought assurance from the DA that the price of onions would not skyrocket like what happened last year when prices soared to P700 a kilo in December.

Laurel said the prevailing market prices of red and white onion on Monday stood at P140 and P110 per kilo, respectively.

""I'm closely monitoring this (onion prices) and we will take steps para hindi na mangyari yung nangyari noong nakaraang taon,"" the agriculture chief said.

As for sugar, Laurel said there are ample stocks of the commodity, but that supply is already contracted to industrial users.

He said sugar should be sold at P85 a kilo, not P100.

""We will do some interventions soon to address this (price disparity) problem. Unfortunately, I cannot divulge publicly kung ano yung mga gagawin natin through the efforts of the Department of Trade and Industry, Sugar Regulatory Administration, and DA,"" Laurel stressed.",https://tribune.net.ph/2023/11/agri-chief-says-actions-taken-to-assure-supply-affordable-prices-of-rice-sugar-onions/,0,,,"{'uri': 'tribune.net.ph', 'dataType': 'news', 'title': 'Daily Tribune', 'ranking': {'importanceRank': 470539, 'alexaGlobalRank': 239561, 'alexaCountryRank': 155154}}",,,TRUE
2023-11-20T14:01:12.563Z,2023-11-164698570,general_biz_trend,57d980ca-52a0-4362-b4d6-57d79043a703,Cocoa prices hover at 45-year highs as lagging harvests kick off 3rd season of shortages,"Cocoa prices are trading at levels not seen in 45 years, as a supply crunch in the commodity drags on for another year.

Prices dipped on Monday, but a string of earlier gains helped push US cocoa futures above $4,000 per metric ton, contributing to an appreciation of over 40% for the year.

It's a price not seen since 1978, Bloomberg reported, and surpasses the 2011 peak that resulted from that year's Ivory Coast export ban on cocoa. But it's still well below the 1977's high of $5,379 per metric ton.

This time around, delayed harvests are exacerbating shortages that have been ongoing for two years, and the supply crunch is heading into a third year.

Harvesting seasons in both Ghana and the Ivory Coast have fallen behind the pace set last year, with bad weather and crop disease concerns driving the lag.

In late October, bean deliveries to Ivory Coast ports were 16% behind this season, a source told Bloomberg.

Outlooks also remain dim as El Nino threatens to dry out West Africa, a detriment to growers. This comes against rising global demand, with processing improving in Europe, Brazil, and the Ivory Coast.

Poor weather and dismal harvests have also weighed on commodities such as sugar, driving its price to a high not seen for over a decade. Poor production in India has led to export curbs on the commodity, in the government's bid to keep domestic sugar prices stable.",https://www.businessinsider.in/stock-market/news/cocoa-prices-hover-at-45-year-highs-as-lagging-harvests-kick-off-3rd-season-of-shortages/articleshow/105365662.cms,0,,,"{'uri': 'businessinsider.in', 'dataType': 'news', 'title': 'Business Insider India', 'ranking': {'importanceRank': 204867, 'alexaGlobalRank': 4739, 'alexaCountryRank': 424}}",,,TRUE
2023-11-20T02:01:03.993Z,7845354004,general_biz_trend,57d980ca-52a0-4362-b4d6-57d79043a703,Chile's Antofagasta settles copper concs TC with Jinchuan at $80/mt for 2024,"Chilean miner Antofagasta settled copper concentrate treatment and refining charges (TC/RC) at $80/mt and 8 cents/lb, respectively, with Jinchuan Group -- a major Chinese copper smelter -- for 2024 term contracts on Nov. 17, the companies told S&P Global Commodity Insights on Nov. 20.

The first annual settlement between a major miner -- in recent years Freeport or Antofagasta -- and leading Chinese smelters in the fourth quarter tends to become the benchmark for the rest of the industry for the year ahead. No offer has been heard from Freeport for the 2024 benchmark yet.

The settled TC/RC between Antofagasta and Jinchuan Group was $8/mt or 0.8 cent/lb lower than the benchmark level for 2023 term contracts, marking the first decline since 2021, which indicated an expectation of tightening copper concentrates supply in 2024.

Some other smelters followed the price in deals with Antofagasta on Nov. 20, according to two market sources.

A major producer said they will follow $80/mt as the number is reasonable.

However, major Chinese smelters such as Jiangxi Copper, Tongling Nonferrous and China Copper haven't made a final decision on accepting the price, according to a smelter source.

""There is a high possibility that the rest of the Chinese leading smelters will follow the agreed number, based on past experience,"" said a Chinese source.

The settled price was higher than Antofagasta's offer heard on Nov. 15 at $72-$75/mt.

Chinese smelters were reluctant to accept TC/RC below $80/mt, as they held the view that copper concentrates supply would remain in surplus in 2024, while the growth of mining might be slower than the smelting capacity expansion.

The market was closely tracking the protests at Quantum's Cobre Panama mine and an export ban on Indonesian-origin copper concentrates from next May, though it hasn't seen any potential impact on copper concentrates supply for 2024 so far, some sources said.

Looking ahead, global copper concentrates supply might see shortages in 2025, as the expansion of refined copper smelting capacity is expected to be far greater than that of copper concentrate supply, sources said.

Meanwhile, despite the recent decline in copper concentrate TC/RC as well as by-product sulfuric acid prices, Chinese smelters have kept their passion for production so far on expectations that the profit margin may remain healthy.

Tradable values for December- and January-loading clean copper concs were heard around $80/mt from the trader to the smelter, and traders see it sliding further due to ongoing demand.

Platts assessed CIF China Clean Copper Concentrates treatment and refining charges at $78.10/mt and 7.81 cents/lb, respectively, Nov. 17, down $6/mt and 0.6 cent/lb on the month, S&P Global data showed.",https://www.spglobal.com/commodityinsights/en/market-insights/latest-news/metals/112023-chiles-antofagasta-settles-copper-concs-tc-with-jinchuan-at-80mt-for-2024,0,,,"{'uri': 'spglobal.com', 'dataType': 'news', 'title': 'spglobal.com', 'ranking': {'importanceRank': 239560, 'alexaGlobalRank': 10400, 'alexaCountryRank': 3469}}",,,TRUE
2023-11-16T20:01:18.467Z,2023-11-160442512,general_biz_trend,57d980ca-52a0-4362-b4d6-57d79043a703,"Report Highlights Further Risks to Food, Commodity Prices in 2023, 2024","* Laments low bank lending to agriculture, inadequate inputs to farmers, seeks greater investments to transform food system

James Emejo in Abuja

A new crop production report has predicted an increase in prices of all major agricultural commodities predicated on a general decline in production and increasing demand across processing and export value chains.

The APEX Wet Season Crop Production Report 2023 which was launched yesterday, also expressed concern that input lending remained a major challenge in the country as banking sector credit to agriculture stood at barely 6.16 per cent in 2022.

The report further identified food insecurity and food inflation as major challenges confronting the country with a 5.7 million metric ton - deficit across human consumption and agro-processing, as well as a historic high food inflation rate of 30.64 per cent.

Specifically, it noted that paddy rice faced the most notable upswing in 2022/2023, partly due to increased flooding and India's rice export ban which contributed to an increase of 34 per cent to baseline pricing of N353,000/mt.

The report said this was expected to rise to N400,000/mt and projected to stabilise at between N480,000 and N500,000/mt by Q3 2023.

It pointed out that Nigeria's Global Hunger Index score remained alarmingly high at 109th out of 125 countries, indicating a severe food security crisis in the country.

The report noted that food prices continued to surge as witnessed in the 2023 season adding that food security challenges would continue to persist, further reducing the Africa's capacity to achieve zero hunger by 2030.

Speaking at the unveiling of the report in Abuja, President/Chief Executive, AFEX Nigeria, Mr. Akinyinka Akintunde, said, ""This year, we nearly doubled our sample size from 20,677 to 39,091 to get an accurate reflection of the current state of agriculture production, and we found that we must take extra care to prioritise improvement in agricultural productivity for these farmers, and this is hinged on investing in the sector, and solving for infrastructure, logistics, and technology gaps.

""This transformation will substantially enhance food self-sufficiency and increase our ability to meet the nutritional and food security needs of a growing population while also bolstering the economy through foreign exchange earnings.""

Essentially, the study delivers insights into six key commodities including maize, paddy rice, soybean, sorghum, cocoa, and sesame, and leverages farmer surveys and measurement of transaction-level data to track vital information across crop production, price performance, and market dynamics.

Akintunde said the report would aid the understanding of the current food system, which needed urgent transformation while providing stakeholders in the commodities market with intelligence to make data-driven trading decisions in the coming season.

Nonetheless, the survey affirmed critical improvement in access to farmland for cultivation in crucial areas, as well as an increase in the usage of improved inputs, such as high-yielding seeds and fertilizers, compared to the preceding season, which contributed to maize and paddy rice being forecasted to have a significantly higher production in the current season.

It stressed that the shortage of reliable data continued to impact the availability of transparent pricing and limits, and constituted a recurring limitation for agriculture on the continent.

The report, among other things, stated that maize and paddy rice were forecasted to have a significantly higher production this season due to expansion in cultivated land and increased fertilizer usage, compared to last season.

Soybean and Sorghum were also expected to decrease modestly due to challenges around seed and land usage while cocoa also faces a decrease in volume due to aging trees and reduced pesticide with sesame growing due to favourable weather and increased international demand.

It added that global trade commodity exchanges, including AFEX, play pivotal roles in promoting fair pricing, managing risk, broadening market access, driving investment, and establishing and enforcing quality standards for agricultural products.",https://www.thisdaylive.com/index.php/2023/11/17/report-highlights-further-risks-to-food-commodity-prices-in-2023-2024,0,,,"{'uri': 'thisdaylive.com', 'dataType': 'news', 'title': 'THISDAYLIVE', 'ranking': {'importanceRank': 247134, 'alexaGlobalRank': 12467, 'alexaCountryRank': 106}}",,,TRUE
2023-11-15T08:01:14.67Z,7836596549,general_biz_trend,57d980ca-52a0-4362-b4d6-57d79043a703,Tin prices likely to rule firm for remainder of 2023,"Tin prices, which topped $25,000 a tonne at close on the London Metal Exchange on Tuesday, are likely to rule firm for the remainder of the year and in the first quarter of 2024 on increasing demand and tight supplies, say analysts.

""LME tin price rallied somewhat this (last) week, approaching $24,800 after a sharp drop to a six-month low at the end of October, amid broader bearish sentiment across base metals,"" said Tom Langston, Senior Market Intelligence Analyst, International Tin Association (ITA).

""...global supplies have tightened over the course of 2023 thus far... TSM (Taiwan Semiconductor Manufacturing) believes the semiconductor industry is close to a bottom and about to enter the next cyclical upturn,"" said research agency BMI, a unit of Fitch Solutions.

Supply fears

""Tin prices increased by 2 per cent in Q32023 from the previous quarter due to supply disruption concerns. The closure of mines in Myanmar, aimed at preserving remaining tin resources, is impacting China's raw material supply,"" said the World Bank in its Commodity Outlook.

Tin mining and processing operations in Myanmnar's key-producing region of Wa have remained suspended since August. The region accounts for nearly one-sixth of the global production and is the main supplier for manufacturers in China.

""Consequently, the world's top consumer was forced to seek tin from alternative sources, driving imports from the Democratic Republic of Congo to soar by 24 per cent in the first three quarters of the year, raising buying competition in other global benchmarks,"" said the Trading Economics website.

Myanmar ban

""Along with rising tin demand from the semiconductor industry, the banning of tin mining in Myanmar's Wa region as well as Indonesia's tin ingot export ban will ensure the global tin market remains tight in the coming months,"" said BMI.

Langston said though a demand boost in fourth quarter festival season appeared uncertain, the Chinese electronics market and the solar sector remained bright spots.

""Recent negative updates from Wa State have pushed back mine reopening estimates, bringing supply resilience into sharper focus as we look towards Q1 2024,"" he said.

BMI said it has raised ""slightly"" its tin price forecasts for 2023 to $25,700/tonne from $25,000 previously as prices remain elevated amid improving demand and tight supplies.

Reached a trough

""Global semiconductor sales data show that the decline in demand for semiconductors since mid-2022 has reached its trough, with sales increasing steadily since July 2023,"" the research agency said.

The World Bank, however, said prices of tin -- which is used in photovoltaic installations, electric vehicles, and electronics -- are expected to decrease by an additional 4 per cent in 2024 from 2023.

""Demand for tin, a key component of electronic manufacturers, is expected to remain subdued reflecting weak economic activity in major economies in 2024,"" it said.

BMI anticipates the soldering metal prices to edge higher in 2024 as the seaborne market will witness a fall in supplies as Myanmar's mining ban extends and Indonesia's ban on tin export comes into force.

The research agency forecast global refined tin production to increase by 1.4 per cent year-on-year in 2023. It expects continued supply growth as new projects in Peru and Malaysia realise a full year of output.

It also revised its forecast higher for global refined tin consumption, which will likely grow by 2.3 per cent y-o-y in 2023 and 2.4 per cent y-o-y in 2024.

SHARE Copy linkEmailFacebookTwitterTelegramLinkedInWhatsAppRedditPublished on November 15, 2023",https://www.thehindubusinessline.com/markets/commodities/tin-prices-likely-to-rule-firm-for-remainder-of-2023/article67536066.ece,0,,,"{'uri': 'thehindubusinessline.com', 'dataType': 'news', 'title': '@businessline', 'ranking': {'importanceRank': 221496, 'alexaGlobalRank': 7140, 'alexaCountryRank': 683}}",,,TRUE
2023-11-06T20:01:11.082Z,2023-11-147609670,general_biz_trend,57d980ca-52a0-4362-b4d6-57d79043a703,Nickel Price: Reduced Stainless Imports Could Cause Shortages,"The Stainless Monthly Metals Index (MMI) moved up with a 7.32% rise from November to December. Meanwhile, the nickel price index appeared decidedly bullish throughout the month.

While nickel prices modestly retraced from their early month rally, upside price action continued to support the short-term range breakout. Sustained increases should foster further bullish anticipation, which could support a continuation of the short-term uptrend. Meanwhile, volumes remained steady coming into December. However, it's important to note how potentially volatile contracts for nickel can become amid low liquidity. This will continue to pose a risk for buyers as price action remains susceptible to a quick reversal.

Get stainless/nickel price forecasts, specific monthly buying strategies, should-cost models, and more with MetalMiner Insights! Request a 30-minute demo of the MetalMiner Insights platform now.

Service Centers Working Through Stainless Inventory Glut

Service centers, brokers, master distributors, and some end users remain flush with inventory. Most service centers indicated that October shipments were relatively flat compared to September. As a result, many have more than four months of stainless inventory on hand. Service center shipments should decline further as they look to reduce stock before December 31. This is key to improving year-end financials and, in some states, avoiding potential inventory tax liabilities. Although 304 base prices have remained steady throughout the year, this supply glut has added downward pressure to stainless steel spot prices.

Cold Rolled Stainless Shortage Risk Amid Import Declines

Alongside these declining service center shipments, imports have slowed significantly in recent months. Indeed, some industry insiders think all U.S. cold rolled stainless steel products could be under allocation as early as March. Meanwhile, import licenses have also declined. This means that service centers, brokers, and master distributors have all pulled back from buying stainless imports. If history repeats itself, the inventory overhang situation will likely be over-corrected. This will lead to stainless cold rolled shortages until enough imports arrive to fill the gap.

That said, the eroding health of the global economy will continue to pressure overall demand. Indeed, reports are circulating that some Indonesian stainless steel producers suffered losses last month due to reduced domestic and global demand. This triggered some plants to indefinitely reduce output, while others implemented scheduled maintenance.

In the U.S. specifically, the manufacturing sector returned to contractionary territory. In fact, for the first time since May of 2020, the ISM Manufacturing PMI descended beneath the expansion/contraction threshold, reading a mere 49 for November. That said, U.S. manufacturing remains strong relative to other parts of the globe. For example, both the Eurozone and Chinese Caixin Manufacturing PMIs have remained below 50 since June.

On Nov. 30, the World Trade Organization (WTO) released its final report on Indonesia's ban on nickel ore exports. As MinerMiner previously noted, the ban went into effect in 2020. At the time, it was part of a larger strategy to attract investments for value-adds to Indonesia's nickel supply chain. The EU challenged the ban on the grounds it unfairly restricted access to key raw materials, specifically for stainless steel producers. As Indonesia's President, Joko Widodo, predicted, the WTO ruled in favor of the EU.

According to the decision, the export ban and domestic processing requirements were inconsistent with an article of the General Agreement on Tariff and Trade. The specified article prohibits WTO members from banning or restricting imports and exports outside of duties or taxes. Indonesia had justified the ban by stating its measures were ""temporary"" and designed to prevent critical shortages of raw materials. Such a move is indeed permitted by other articles within the agreement.

Despite the loss, Indonesia plans to appeal. As a whole, the ban was wildly successful for the country. Indeed, it will likely serve as an incentive for Indonesia to continue limiting exports in some form. Currently, the country accounts for roughly 38% of global nickel production, giving it significant influence over the nickel price. In fact, due to the investments the ban triggered, the archipelago has since become the second-largest producer of stainless steel.

Of course, the WTO's decision will not undo Indonesia's newfound dominance within global stainless steel production. Many insiders expect Indonesia to adopt some form of export duty allowed by trade regulations in the near future.

Get weekly updates on nickel price trends and other commodity news with MetalMiner's free weekly newsletter. Click here.

How Long Will the Nickel Price Index Remain Bullish?

The nickel price index showed a short-term uptrend last month. However, an element of directional uncertainty remains. The downturn in Europe and the threat of a prolonged recession in the U.S. will continue to drag on prices. As mentioned above, the largest consumer of nickel, stainless steel production, appears to have peaked due to eroding demand.

On top of that, a number of the factors that underpinned last month's bullishness have since evaporated. Contrary to market expectations, the LME chose not to ban or limit Russian material. Albeit less surprising, the removal of Indonesia's export ban will also add downside pressure to the nickel price. That said, this has yet proven sufficient to shift price direction. Moreover, the decision's impact could be further mitigated should Indonesia implement previously announced nickel pig iron (NPI) tariffs or any new duties to replace the ban.

China's shifting approach to zero-COVID served as the other dynamic force. The month opened to rumors of a potential end date, which supported a rally across the base metal category. By mid-month, however, the rallies stagnated amid record outbreaks and new lockdowns. Then, in an unexpected twist, rampant protests and growing social unrest caused Beijing to unravel lockdowns and again loosen restrictions.

China reopening will likely prove a slow process. They currently face a surging exit wave and low public immunity due to lack of exposure. Still, the move will nonetheless have a bullish effect on metal prices as the country's demand reemerges. How bullish remains uncertain as China continues to grapple with other economic challenges, including its property sector crisis, an aging population, and high debt levels.

Overwhelmed by shifting stainless market dynamics? Improve metal purchase timing and mitigate price risk with a comprehensive outlook. Click to trial MetalMiner's monthly metal buying outlook.

Biggest Stainless Steel and Nickel Price Moves

The Indian primary nickel price saw the largest month-over-month increase for the second month in a row, with a 28.04% rise to $30.68 per kilogram as of December 1.",https://cloneagmetalminer.kinsta.cloud/2022/12/07/nickel-price-reduced-stainless-imports/,0,,eng-9037326,"{'uri': 'cloneagmetalminer.kinsta.cloud', 'dataType': 'news', 'title': 'MetalMiner', 'ranking': {'importanceRank': 1000000}}",,,TRUE
