INSERT_DATETIME,URI,TOPIC,TOPIC_URI,TITLE,BODY,URL,RELEVANCE_CLASS,BODY_SUMMARY,EVENTURI,SOURCE,METADATA,ARTICLE_HIERARCHY,VERIFIED
2023-11-22T08:01:15.222Z,7849441905,general_medical_trend,7e974a24-3df6-40a6-b8aa-a1d5bd15a5e5,"Shipments to African countries herald final steps toward broader vaccination against malaria: Gavi, WHO and UNICEF","These shipments signal that malaria vaccination is moving out of its pilot phase, and lay the groundwork for countries to begin vaccinations through Gavi-supported routine immunization programmes in Q1 2024

Shipments of the world's first WHO-recommended malaria vaccine, RTS,S, have begun with 331 200 doses landing last night in Yaoundé, Cameroon. The delivery is the first to a country not previously involved in the malaria vaccine pilot programme and signals that scale-up of vaccination against malaria across the highest-risk areas on the African continent will begin shortly.

Nearly every minute, a child under five dies of malaria. In 2021, there were 247 million malaria cases globally, which led to 619 000 deaths. Of these deaths, 77 per cent were children under 5 years of age, mostly in Africa. Malaria burden is the highest on the African continent, which accounts for approximately 95% of global malaria cases and 96% of related deaths in 2021.

A further 1.7 million doses of the RTS,S vaccine are expected to arrive in Burkina Faso, Liberia, Niger and Sierra Leone in the coming weeks, with additional African countries set to receive doses in the months ahead. This reflects the fact that several countries are now in the final stage of preparations for malaria vaccine introduction into routine immunisation programmes, which should see first doses administered in Q1 2024.

Comprehensive preparations are needed to introduce any new vaccine into essential immunisation programmes - such as training of healthcare workers, investing in infrastructure, technical capacity, vaccine storage, community engagement and demand, and sequencing and integrating rollout alongside the delivery of other vaccines and health interventions. Delivering the malaria vaccine has the added challenge of a four-dose schedule which requires careful planning to effectively deliver.

Since 2019, Ghana, Kenya, and Malawi have been administering the vaccine in a schedule of 4 doses from around 5 months of age in selected districts as part of the pilot programme, known as the Malaria Vaccine Implementation Programme (MVIP). More than 2 million children have been reached with the malaria vaccine in the three African countries through MVIP - resulting in a remarkable 13% drop in all-cause mortality in children age-eligible to receive the vaccine, and substantial reductions in severe malaria illness and hospitalizations. Other key findings from the pilot programme show that vaccine uptake is high, with no reduction in use of other malaria prevention measures or uptake of other vaccines. MVIP is coordinated by WHO in collaboration with UNICEF and other partners, and funded by Gavi, the Global Fund, and UNITAID, with donated doses from GSK, the manufacturer of the RTS,S vaccine.

The data from the pilot have shown the impact and safety of the RTS,S vaccine and provided important evidence on vaccine acceptability and uptake that helped inform the recent WHO recommendation of a second malaria vaccine - R21, manufactured by the Serum Institute of India (SII). Results of a phase 3 trial for R21 showed that the vaccine has a good safety profile in the clinical trial setting and reduces malaria in children. It is expected that, like RTS,S, when R21 is implemented it will have similar high public health impact. The choice of which vaccine to be used in a country should be based on programmatic characteristics, vaccine supply, and affordability.

The R21 vaccine is currently under review by WHO for prequalification. The availability of two malaria vaccines is expected to increase supply to meet the high demand from African countries and result in sufficient vaccine doses to benefit all children living in areas where malaria is a public health risk. In preparation for scaled-up vaccination, Gavi, WHO, UNICEF and partners are working with countries that have expressed interest and/or have confirmed rollout plans on the next steps.

These developments mean that broad implementation of malaria vaccination in endemic regions has the potential to be a gamechanger for malaria control efforts, and could save tens of thousands of lives each year. However, malaria vaccines are not a standalone solution. They should be introduced in the context of the WHO-recommended package of malaria control measures which include insecticide-treated nets, indoor residual spraying, intermittent preventive treatment in pregnant women, antimalarials, effective case management, and treatment, all of which have helped to reduce malaria-related deaths since 2000. Importantly, the MVIP showed that delivering vaccines alongside non-vaccine interventions can reinforce the uptake of other vaccines and the use of insecticide treated nets, and overall boost access to malaria prevention measures.

""The world needs good news - and this a good news story,"" said David Marlow, CEO of Gavi, the Vaccine Alliance. ""Gavi is proud that our Alliance of stakeholders, with African countries at the forefront, took the decision to invest in the malaria vaccine as a public health priority, and that this support has played a part in the availability of a new tool that can save the lives of thousands of children each year. We are excited to rollout this historic vaccine through Gavi programmes and work with partners to ensure it is delivered alongside other vital measures.""

""This could be a real gamechanger in our fight against malaria,"" said UNICEF Executive Director Catherine Russell. ""Introducing vaccines is like adding a star player to the pitch. With this long-anticipated step, spearheaded by African leaders, we are entering a new era in immunization and malaria control, hopefully saving the lives of hundreds of thousands of children every year.""

""This is another breakthrough moment for malaria vaccines and malaria control, and a ray of light in a dark time for so many vulnerable children in the world. The delivery of malaria vaccines to new countries across Africa will offer life-saving protection to millions of children at risk of malaria,"" said WHO Director-General Dr Tedros Adhanom Ghebreyesus. ""But we must not stop here. Together, we must find the will and the resources to bring malaria vaccines to scale, so more children can live longer, healthier lives.""

""This is a significant advancement towards scaling up malaria vaccination in the region. The vaccine, which protects children from the severe forms of the disease, is a vital addition to the existing set of malaria prevention tools and will help bolster our efforts to reverse the rising trend in cases and further reduce deaths,"" said Dr Matshidiso Moeti, WHO Regional Director for Africa.

Quotes from countries and stakeholders

""The arrival of the RTS,S/AS01 malaria vaccine in Burkina Faso marks a historic milestone in our efforts to combat malaria, which remains a major public health threat. Malaria is in fact the primary cause for consultations, hospitalization and death in our health facilities. Children under 5 pay the heaviest price. We are hopeful that the introduction of this vaccine into routine immunisation for children aged 0 to 23 months will have the potential to reduce the burden of this disease and save many lives,"" said Dr Robert Lucien Jean-Claude Kargougou, Burkina Faso's Minister of Health and Public Hygiene.

""We are committed to ensuring that the vaccine reaches eligible children, and we encourage all parents to take advantage of this life-saving intervention."" ""The government remains committed to strengthening other malaria prevention and control measures"". ""The arrival of the vaccines marks a historic step in our efforts to control malaria, which remains a major public health threat in the country. We're grateful for the support of our partners with whom we're committed to working to ensure that the vaccines reach the children and protect them from this deadly disease,"" said Hon Dr Malachie Manaouda, Minister of Public Health of Cameroon. ""As we vaccinate children, the government also remains committed to strengthening other prevention and control measures so that we can lower the huge burden of malaria.""

""The introduction of the RTS,S/AS01 malaria vaccine in Liberia marks a significant milestone in our efforts to combat malaria which is the leading cause of infant and under five mortality. This vaccine has the potential to save many lives and reduce the burden of this disease on our population,"" said Hon Dr Wilhemina Jallah, Minister of Health of Liberia. ""We are committed to ensuring that the vaccine reaches those who need it the most, and we encourage all parents of eligible children to take advantage of this life-saving intervention.""

""Today's announcement is welcome news given that malaria remains a primary cause of childhood illness and death in sub-Saharan Africa,"" said Peter Sands, Executive Director of the Global Fund. ""Using this vaccine, appropriately prioritized in the context of existing tools, could help prevent malaria and save tens of thousands of young lives each year.""

""I am thrilled that the RTS,S vaccine, which is the result of so many years of work by PATH, GSK, and African partners, has arrived in Cameroon and will soon reach even more children at risk of malaria,"" said Nikolaj Gilbert, President and CEO of PATH. ""All of us at PATH appreciate the efforts by Gavi, UNICEF, and WHO to accelerate access to this life-saving vaccine.""

""As the scale up of the world's first malaria vaccine begins, the U.S. President's Malaria Initiative congratulates the Gavi Secretariat and Ministries of Health throughout Africa,"" said Dr. David Walton, U.S. Global Malaria Coordinator. ""This moment has been decades in the making and the U.S. has supported malaria vaccine development for decades. To maximize the benefit of this lifesaving tool, we will enthusiastically continue our partnerships with Ministries of Health and national, regional, and global partners to achieve a world in which no child dies from a mosquito bite.""

Notes to editors

Please explore links below for photos and multimedia content related to malaria vaccines, including photos and footage of the vaccines on the move from the GSK factory, and arriving in Cameroon. Additional content will continue to be added in the coming days and weeks.

For further information about these shipments, please see ""Frequently Asked Questions"".

About Gavi, the Vaccine Alliance

Gavi, the Vaccine Alliance is a public-private partnership that helps vaccinate more than half the world's children against some of the world's deadliest diseases. The Vaccine Alliance brings together developing country and donor governments, the World Health Organization, UNICEF, the World Bank, the vaccine industry, technical agencies, civil society, the Bill & Melinda Gates Foundation and other private sector partners. View the full list of donor governments and other leading organisations that fund Gavi's work here.

Since its inception in 2000, Gavi has helped to immunise a whole generation - over 1 billion children - and prevented more than 17.3 million future deaths, helping to halve child mortality in 78 lower-income countries. Gavi also plays a key role in improving global health security by supporting health systems and outbreak response as well as funding global stockpiles for Ebola, cholera, meningococcal and yellow fever vaccines. After two decades of progress, Gavi is now focused on protecting the next generation, above all the zero-dose children who have not received even a single vaccine shot. The Vaccine Alliance employs innovative finance and the latest technology - from drones to biometrics - to save lives, prevent outbreaks before they can spread and help countries on the road to self-sufficiency.

UNICEF works in some of the world's toughest places, to reach the world's most disadvantaged children. Across 190 countries and territories, we work for every child, everywhere, to build a better world for everyone. For more information about UNICEF and its work for children, visit www.unicef.org. Find out more about UNICEF's work on the COVID-19 vaccines here, or about UNICEF's work on immunization here.

About WHO",https://www.who.int/news/item/22-11-2023-shipments-to-african-countries-herald-final-steps-toward-broader-vaccination-against-malaria--gavi--who-and-unicef,-1,,eng-9081233,"{'uri': 'who.int', 'dataType': 'news', 'title': 'who.int', 'ranking': {'importanceRank': 162264, 'alexaGlobalRank': 1298, 'alexaCountryRank': 1813}}",,,TRUE
2023-11-17T02:01:26.818Z,2023-11-160555689,general_medical_trend,7e974a24-3df6-40a6-b8aa-a1d5bd15a5e5,Cervical Cancer Elimination Day of Action 2023,"Marking the Third Year of the Cervical Cancer Elimination Effort

By Dr Poonam Khetrapal Singh, WHO Regional Director for South-East Asia

As of 2020, the SEA Region accounted for a substantial portion of the global cervical cancer burden, with 200,000 new cases (32% of the global burden) and 100,000 deaths (34% of global fatalities), according to Global Cancer Observatory 2020. The global strategy for elimination was launched by the World Health Organization (WHO) in November 2020. Since the launch of the global strategy, Member States have demonstrated commendable political will, exemplified by the formulation and launch of elimination strategies at national level. The Interim targets within the three key pillars of the strategy are promising, viz:

Member States have made remarkable progress in preventing, screening, and managing cervical cancer. Under the Flagship Priority of ""Prevention and control of noncommunicable diseases through multisectoral policies and plans, with a focus on best buys,"" cervical cancer prevention is one of the 'best buys.'

Over the past three years, the South-East Asia Region has achieved several milestones in the elimination roadmap, marked by the development and implementation of strategic frameworks as

The SEA Region is among the pioneers in creating an implementation framework aligned with the global strategy for eliminating cervical cancer.

As of today, six Member States of the Region have introduced the HPV vaccine nationwide (Bhutan, Indonesia, Maldives, Myanmar, Sri Lanka and Thailand), two Member States (India in Sikkim State and Bangladesh in Dhaka Division) have introduced it at sub-national level, two have planned introduction of the vaccine in 2023-24 (Nepal and Timor-Leste) while one (India) has plans to increase the scope of HPV vaccination by expanding its use to additional states. The coverage of HPV vaccination among the target girls in Bhutan has been high since 2017. Some of the other countries in the Region that faced challenges of HPV vaccine rollout during the COVID-19 pandemic are organizing catch-up vaccinations. Further, the WHO recommendation on one-dose schedule of HPV vaccination as an alternative to the two-dose schedule has been adopted by some Member States in the region.

On screening, ten out of 11 Member States reported national population-based screening programs, with nine providing early detection services at the primary health care level. Progress has been made in adopting HPV DNA screening, with Bhutan and Thailand leading in its utilization. However, achieving the 70% target by 2030 requires sustained efforts. However, a positive development is that screening has been included in essential service packages or UHC packages in several Member States.

Several Member States have established centers for managing cervical precancerous lesions, including colposcopy and thermal ablation methods. WHO support has played a pivotal role in capacity building and establishing treatment facilities. In 2022-23, WHO supported Timor-Leste in setting up the first-ever facility for treating precancerous lesions (Colposcopy and Thermal ablation) in the national hospital and expanding to three more colposcopy centers with thermal ablations. Bhutan and Myanmar were also supported in the expansion of these facilities.

Ten Member States in the region have tertiary-level cancer care. Pathology services for cancer diagnosis, chemotherapy and cancer surgeries are also available in ten countries. Nine countries have services for radiation therapy. With the aim of accelerating the scaling up of treatment services for invasive cancers, SEARO has established the South-East Asia Cancer Grid (SEACanGrid), which facilitates leveraging the strengths of one institution in building capacity of another across countries. Primary health care and community-based palliative care is expanding in the region, with exemplary initiatives in Bhutan, India and Sri Lanka. Population-based cancer registries are operational and being strengthened in eight Member States.

Ensuring all women have access to affordable and effective cervical cancer prevention and management services remains a priority. While ten out of 11 Member States report having pathology services for cancer diagnosis, cancer treatment facilities at tertiary levels, including surgical, chemotherapy, and radiotherapy services, are not universally accessible, especially among socioeconomically disadvantaged groups. To address this, a robust health system through Universal Health Coverage is imperative, ensuring services are available without causing catastrophic expenditure to beneficiaries.

Despite setbacks caused by the COVID-19 pandemic, efforts to resume and strengthen HPV vaccination and cervical cancer screening programs are underway.

It is crucial to emphasize that cervical cancer is a preventable and curable disease if detected early and treated adequately. The commitment and support of Member States extended during the Regional Committee meetings of WHO-SEARO to the global cervical cancer elimination initiative is unwavering, as demonstrated by dedicated discussions and agenda items during Regional Committee meetings held in 2019 and 2022.

Let us continue our collaborative efforts, navigate challenges, and propel the region towards the shared goal of eliminating cervical cancer.",https://www.who.int/southeastasia/news/detail/17-11-2023-cervical-cancer-elimination-day-of-action-2023-ms,-1,,eng-9062161,"{'uri': 'who.int', 'dataType': 'news', 'title': 'who.int', 'ranking': {'importanceRank': 162264, 'alexaGlobalRank': 1298, 'alexaCountryRank': 1813}}",,,TRUE
2023-11-16T08:01:35.425Z,2023-11-159786919,general_medical_trend,7e974a24-3df6-40a6-b8aa-a1d5bd15a5e5,"Message by the Director of the Department of Immunization, Vaccines and Biologicals at WHO - October 2023","In global healthcare, we are witnessing remarkable progress in the prevention of cervical cancer, a brighter future for malaria control, and a rallying call for more rapid progress on routine vaccinations.

Cervical cancer prevention soars to new heights

The fight against cervical cancer is scaling rapidly, thanks in large part to the growing momentum of HPV vaccination programs. In October, Nigeria, Bangladesh, and Cambodia joined the ranks of countries that include human papillomavirus (HPV) vaccine in the national schedule, following Indonesia's successful national rollout. These nations, home to substantial populations, shoulder a significant portion of the global cervical cancer burden.

Adding to the excitement is the upcoming introduction of HPV vaccination in India, and Pakistan's announcement of their intent to join the ranks of countries protecting women from cervical cancer. In a further boost to this cause, the Democratic Republic of the Congo's National Immunization Technical Advisory Group (NITAG), has recommended adding HPV vaccine to the national vaccination schedule. Collectively, these seven countries account for a third of the global cervical cancer burden, which will be significantly reduced in the future through HPV vaccination in the here and now.

Malaria control: a ray of hope

The battle against malaria is also witnessing a remarkable advance, thanks to the addition of malaria vaccine to the existing toolbox of malaria control interventions. With the completion of the pilot implementation of the RTS, S/AS01 malaria vaccine in Ghana, Kenya, and Malawi we are learning about the dimensions of vaccine impact. Recently presented data show a 13% reduction in all-cause mortality (excluding trauma) among children eligible for vaccination. Notably this impact was achieved at approximately 64-74% coverage, previewing the likelihood of even greater impact as the coverage scales up. Adding malaria vaccine to the portfolio of malaria interventions is about optimizing the mix of interventions, each of which are imperfect. Not only does this ease the health burden and suffering of children and their families, but also translates into substantial cost savings for healthcare systems.

The good news doesn't stop there. Nine additional countries, including Benin, Burkina Faso, Burundi, Cameroon, the Democratic Republic of the Congo, Liberia, Niger, Sierra Leone, and Uganda, are set to introduce the vaccine into their routine immunization programs beginning in early 2024. With a WHO policy recommendation for the second malaria vaccine, R21/Matrix-M, now in place, additional countries are also planning for introduction, given the expectation for sufficient supply, once the R21/Matrix-M vaccine achieves WHO prequalification. Having vaccines against malaria is a testament to the power of innovation and global collaboration in the fight against malaria.

Measles outbreaks and the importance of fully vaccinated children

The immunization community is anticipating the joint report by WHO and the Centers for Disease Control (CDC) on the 2022 measles case and mortality estimates, scheduled for release later today 16 November. Measles, one of the most highly infectious diseases, is making an unwanted comeback, with cases and deaths increasing globally. While Africa and South Asia have faced challenges with measles in the wake of the pandemic, other regions are also contending with outbreaks: from richer countries such as Austria and the UK, to middle-income ones like Russia, South Africa and Türkiye.

Measles is not the sole concern resulting from declining vaccination rates. As vaccine coverage decreases, measles tends to resurface first due to its high contagiousness. However, declining vaccination rates set the stage for other serious vaccine-preventable diseases to reemerge. Measles outbreaks serve as a warning sign for potential outbreaks of severe illnesses such as whooping cough, diphtheria, or polio.

In conclusion, under the banner of ""The Big Catch-Up"", it is crucial to support countries in reestablishing routine vaccination programs, improving their coverage and reaching the most left out, wherever they are found, in order to prevent large-scale global outbreaks of vaccine-preventable diseases.",https://www.who.int/news/item/16-11-2023-message-by-the-director-of-the-department-of-immunization--vaccines-and-biologicals-at-who---october-2023,-1,,eng-9062694,"{'uri': 'who.int', 'dataType': 'news', 'title': 'who.int', 'ranking': {'importanceRank': 162264, 'alexaGlobalRank': 1298, 'alexaCountryRank': 1813}}",,,TRUE
